{
  "id": "arena_003",
  "slug": "cite-your-sources-claude-vs-chatgpt",
  "format": "model-arena",
  "title": "Find the figure and prove it: Claude vs ChatGPT",
  "status": "live",
  "category": "Research",
  "testedOn": "2026-07-26",
  "brief": "You look after payroll and HR admin for a small company in England. You need three current figures, and your finance director will want to see where each one comes from. AI tools often get this kind of task quietly wrong, because a confident wrong number with a broken link looks exactly like a confident right one. You give the same request to two tools, then you click every link they give you.",
  "summary": "Three payroll figures that have to be right, each with a link your finance director can check. You click every link and see which tool sends you somewhere that proves the number.",
  "preview": {
    "taskCue": "Official figures, with sources",
    "outcome": "Whether a confident answer comes with links that actually open and actually show the figure.",
    "specimen": {
      "kind": "pairs",
      "caption": "The three figures this lab asks for",
      "items": [
        {
          "label": "National Living Wage, 21 and over",
          "value": "asked for with a GOV.UK link"
        },
        {
          "label": "Statutory Sick Pay, weekly rate",
          "value": "asked for with a GOV.UK link"
        },
        {
          "label": "Redundancy pay, weekly cap",
          "value": "asked for with a GOV.UK link"
        }
      ]
    }
  },
  "matchup": [
    {
      "name": "Claude",
      "modelId": "claude-opus-5",
      "modelLabel": "Claude Opus 5",
      "howRun": "Generated directly from Claude Opus 5 on 2026-07-26 with web search switched on, as it is by default in the consumer app."
    },
    {
      "name": "ChatGPT",
      "modelId": "gpt-5.6-sol",
      "modelLabel": "OpenAI GPT-5.6 Sol",
      "howRun": "Generated via the Codex CLI 0.144.1 on 2026-07-26, set to its most careful answer mode, which OpenAI calls high reasoning effort, with web search switched on. It ran four searches, all restricted to gov.uk."
    }
  ],
  "prompt": "I look after payroll and HR admin for a small company in England with eighteen staff. I need three current figures, and I need to be able to show my finance director exactly where each one comes from.\n\n1. The National Living Wage hourly rate for a worker aged 21 or over.\n2. The standard weekly rate of Statutory Sick Pay.\n3. The maximum weekly pay figure used when working out statutory redundancy pay.\n\nFor each one, give me the figure, the date it applies from, and a link to the official GOV.UK page I can check it on myself. If you are not certain a figure is current, say so plainly rather than guessing. Use British English and keep it short enough to paste into an email.",
  "outputs": [
    {
      "by": "Claude",
      "verbatim": "I have checked all three on GOV.UK just now. Here they are, ready to paste.\n\n1. National Living Wage, 21 and over\n£12.71 an hour, from 1 April 2026.\nSource: https://www.gov.uk/national-minimum-wage-rates\n\n2. Statutory Sick Pay, standard weekly rate\n£123.25 a week, or 80% of the employee's normal weekly earnings, whichever is lower. This is the 2026 to 2027 tax year rate.\nSource: https://www.gov.uk/statutory-sick-pay/what-youll-get\n\n3. Maximum weekly pay for statutory redundancy pay\n£751 a week, for redundancies on or after 6 April 2026. That caps a statutory redundancy payment at £22,530.\nSource: https://www.gov.uk/redundancy-your-rights/redundancy-pay\n\nTwo things worth flagging to your finance director, because they are easy to miss.\n\nThe SSP figure is no longer a simple flat rate. From 6 April 2026 it is the lower of £123.25 and 80% of the employee's normal weekly earnings, so for your lower paid staff the answer will often be less than £123.25. If your payroll software has not been updated, check it.\n\nThe two dates are different. The wage rate changed on 1 April 2026, the redundancy cap on 6 April 2026. Anyone made redundant between those dates falls under the previous cap.\n\nOne page that has all three in one place, if your finance director would rather have a single link:\nhttps://www.gov.uk/guidance/rates-and-thresholds-for-employers-2026-to-2027\n\nI have quoted the figures as GOV.UK states them today, 26 July 2026. These rates normally change each April, so it is worth re-checking the pages rather than reusing this email next spring."
    },
    {
      "by": "ChatGPT",
      "verbatim": "Checked against GOV.UK on 26 July 2026:\n\n1. **National Living Wage (age 21+)**: **£12.71 per hour**, from **1 April 2026**. [GOV.UK rates](https://www.gov.uk/national-minimum-wage-rates)\n\n2. **Statutory Sick Pay**: **£123.25 per week**, from **6 April 2026**. The amount payable is the lower of £123.25 and 80% of average weekly earnings. [GOV.UK SSP guidance](https://www.gov.uk/guidance/statutory-sick-pay-manually-calculate-your-employees-payments)\n\n3. **Statutory redundancy pay weekly-pay cap**: **£751 per week**, for redundancies on or after **6 April 2026**. [GOV.UK redundancy guidance](https://www.gov.uk/redundancy-your-rights/redundancy-pay)"
    }
  ],
  "rubric": [
    {
      "criterion": "Does every figure come with a link you can click?",
      "goodLooksLike": "Three figures, three links, no figure left floating on its own."
    },
    {
      "criterion": "Do the links go to GOV.UK itself, rather than to a payroll blog?",
      "goodLooksLike": "When the page opens, the website name in your browser's address bar is exactly www.gov.uk, because that is the source your finance director will accept."
    },
    {
      "criterion": "Does the page it links to actually show the figure and the date?",
      "goodLooksLike": "You open the link and the number is there, with the date it applies from."
    },
    {
      "criterion": "Does it flag anything that has recently changed?",
      "goodLooksLike": "It tells you which rule moved, not just what today's number is."
    },
    {
      "criterion": "Could you paste it into an email without editing it?",
      "goodLooksLike": "Short, plain, and no waffle you would have to cut first."
    }
  ],
  "verdict": {
    "winner": "Close. ChatGPT for the citation, Claude for the warnings",
    "callText": "Both tools got all three figures right. Every one was checked against GOV.UK on the day of the test: the National Living Wage for a worker aged 21 or over is £12.71 an hour from 1 April 2026, Statutory Sick Pay is £123.25 a week or 80% of normal weekly earnings, whichever is lower, and the redundancy cap is £751 a week for redundancies on or after 6 April 2026. Every link in both answers is a real GOV.UK page that opens. Neither tool invented a source in this test. Tools like these can, so clicking every link is still the habit to keep.\n\nThe difference is what each chose to link to. ChatGPT's sick pay link goes to the HMRC guidance on working out payments manually, which states the rate and the exact period it runs for, 6 April 2026 to 5 April 2027. That is the page you want when someone asks where the date comes from. Claude linked the employee-facing sick pay page instead, which gives the amount but not the date it applies from, so its \"2026 to 2027 tax year\" claim is not proved by the page it cites.\n\nClaude also adds one link at the end, for a page it says has all three figures in one place. It does not. That HMRC page of rates and thresholds for employers gives the wage rate and the sick pay rate, but not the redundancy cap. This is exactly what the lab asks you to check: the link opens and looks official, but it does not prove everything the answer says it does.\n\nClaude is more useful on what has changed. It flags that sick pay is no longer a flat rate, so lower paid staff will often get less than £123.25, and that the wage rate changed on 1 April while the redundancy cap changed on 6 April, which matters for anyone made redundant in that gap. ChatGPT mentions the 80% rule in passing and says nothing about the date gap.\n\nNeither said \"I am not sure\". Both searched and found current figures, but as Claude's summary link shows, a confident answer can still cite a page that does not prove every figure.\n\nIn this test, ChatGPT's answer is tighter and its sick pay citation is the better one, so it is the answer you would paste into the email. If you are the person who gets blamed when a figure turns out to be out of date, Claude's warnings are the part you would miss.",
    "freshnessNote": "Tested on 26 July 2026 with Claude Opus 5 and OpenAI GPT-5.6 Sol. Models change often and so do these rates, which normally rise each April. This verdict is only true for these versions on this date, and the figures quoted are only true for the day they were checked."
  },
  "tryItYourself": [
    "Pick three figures you have to be right about in your own job. A rate, a threshold, a deadline.",
    "Open claude.ai and chatgpt.com, and give both the same wording: the figure, the date it applies from, and an official link you can check.",
    "Click every link. This is the whole test. When each page opens, check the address bar shows the official website of the organisation responsible for the figure, such as www.gov.uk for UK government rates. A link that does not open, or that goes to a consultancy blog rather than the official source, is a fail however confident the answer sounds.",
    "Check that the figure on the page matches the figure in the answer. They do not always.",
    "Score both against the five questions above, then write down what you would check before using either answer."
  ]
}
